# Summary: total rows=1846, high‑quality=1112, most common stacks=Other (743); Shopify Advanced (412); WordPress + WooCommerce (397), best SaaS=https://script.tonatheme.com/tonaptc/demo/, best Booking=https://iowaschoolforthedeaf.org/, best E‑commerce=https://martfury.botble.com/
https://siouxlandship.org/,Education,"Squarespace, Bootstrap","Shopping Cart, Contact Form","Siouxland Human Investment Partnership (SHIP) is an Iowa licensed 501(c)3 nonprofit organization that serves primarily as a local grant administering and servicing agency for the Siouxland area. SHIP is an organization capable of administering major initiatives with a Health, Human Service, Education and Public Safety focus and has a scope of pre-birth to death.",High,Other,"payment integration, lms, learning management system, shopping cart",Education platform built with Other that provides an online store with payment integration.,Full shopping cart and checkout flow
https://high-end-multipurpose-lms.vercel.app/,Education,"React, Next.js","Authentication/Login, Search Functionality, Newsletter, Contact Form",A comprehensive learning management system for Asian educational institutions and businesses.,High,React / Next.js Custom,"spa, lms, react, learning management system, search functionality, ssr, next.js",Education platform built with React / Next.js Custom that delivers a learning management platform.,Strong React frontend | SSR with Next.js for SEO
https://high-end-multipurpose-lms.vercel.app/,Education,"React, Next.js","Authentication/Login, Search Functionality, Newsletter, Contact Form",A comprehensive learning management system for Asian educational institutions and businesses.,High,React / Next.js Custom,"spa, lms, react, learning management system, search functionality, ssr, next.js",Education platform built with React / Next.js Custom that delivers a learning management platform.,Strong React frontend | SSR with Next.js for SEO
https://www.altoona-iowa.com/,Education,"React, Bootstrap, jQuery, Cloudflare","Authentication/Login, Search Functionality, Multilingual, Newsletter, Contact Form","City of Altoona, Iowa | A Development Friendly Community",High,React / Next.js Custom,"spa, lms, react, learning management system, search functionality, multilingual",Education platform built with React / Next.js Custom that delivers a learning management platform.,Strong React frontend | SSR with Next.js for SEO | Multilingual support for global audience
https://www.dsmzencenter.org,Education,"Webflow, jQuery","Payment Integration, Newsletter, Contact Form","The aim of the Zen Center is to provide a place where people can examine their lives, their intentions, their relationship to the world.",High,Webflow,"lms, learning management system",Education platform built with Webflow that delivers a learning management platform.,
https://novoed.com/,Education,"WordPress, WooCommerce, jQuery","Search Functionality, Blog, Multilingual","Built by training leaders, the NovoEd talent development platform harnesses industry expertise to empower your organization to achieve measurable results.",High,WordPress + WooCommerce,"lms, wordpress, learning management system, search functionality, multilingual, e-commerce, woocommerce",Education platform built with WordPress + WooCommerce that delivers a learning management platform.,WordPress + WooCommerce integration | Multilingual support for global audience
https://www.realchoicefinance.com.au/,Education,"WordPress, WooCommerce, React, Vue.js, Bootstrap, jQuery",Contact Form,Your Local Toowoomba Mortgage Brokers Helping you with Home LoansSMSF LoansConstruction LoansInvestment Loans Browse Our Services Book a Free Consultation What type of loan do you need? Our Core Services First Home Buyer Guidance Home & Investment Loans Construction Loans Refinancing & Debt Consolidation Self-Employed Lending Solutions Ongoing Loan Reviews View All Service Mortgage Brokers,High,WordPress + WooCommerce,"spa, lms, react, wordpress, learning management system, e-commerce, woocommerce",Education platform built with WordPress + WooCommerce that delivers a learning management platform.,Strong React frontend | WordPress + WooCommerce integration
https://youssefhodaigui.com/,Education,"WordPress, WooCommerce, Tailwind CSS, jQuery","Search Functionality, Blog, Newsletter",Moroccan-American AI business strategist with 25+ years building and scaling online businesses. Founder of Mindflow Marketing & EarningPath. Helping professionals become AI-powered entrepreneurs through proven systems and real-world experience.,High,WordPress + WooCommerce,"lms, wordpress, learning management system, search functionality, e-commerce, woocommerce",Education platform built with WordPress + WooCommerce that delivers a learning management platform.,WordPress + WooCommerce integration
https://dagga.academy/home-1-2/,Education,"WordPress, WooCommerce, React, Bootstrap, jQuery","Authentication/Login, Search Functionality",dagga.academy is a learning network created by The Future Cannabis Project. It's part social network where the cannabis community can share ideas and wisdom with each other. It's part online education where experts guide you from seed to shelf. We're just getting started. We hope you join.,High,WordPress + WooCommerce,"spa, lms, react, wordpress, learning management system, search functionality, e-commerce, woocommerce",Education platform built with WordPress + WooCommerce that delivers a learning management platform.,Strong React frontend | WordPress + WooCommerce integration
https://westbridgehotels.com/,Education,"WordPress, WooCommerce, React, jQuery","Search Functionality, Booking System, Blog, Contact Form",Westbridge Inn & Suites offers Clean and comfortable Rooms at affordable Price. Offers Indoor and Outdoor lodging in Centerville Iowa.,High,WordPress + WooCommerce,"spa, lms, booking system, react, wordpress, learning management system, search functionality, appointment scheduling, e-commerce, woocommerce",Education platform built with WordPress + WooCommerce that enables appointments and real‑time bookings.,Strong React frontend | WordPress + WooCommerce integration | Robust booking system with payment
https://iowayouthchorus.org/,Education,"WordPress, WooCommerce, React, Vue.js, jQuery","Authentication/Login, Contact Form",Iowa Youth Chorus offers programming for students in 1st - 12th grade. We’ve been making beautiful music since 1981.,High,WordPress + WooCommerce,"spa, lms, react, wordpress, learning management system, e-commerce, woocommerce",Education platform built with WordPress + WooCommerce that delivers a learning management platform.,Strong React frontend | WordPress + WooCommerce integration
https://ljic.edu/,Education,"WordPress, WooCommerce, React, jQuery","Search Functionality, Booking System, Blog, Contact Form","Learn hair, skin, nail, teaching, and more at La’ James International College! Be sure to take a tour of one of our Iowa campuses. Schedule your tour with us today!",High,WordPress + WooCommerce,"spa, lms, booking system, react, wordpress, learning management system, search functionality, appointment scheduling, e-commerce, woocommerce",Education platform built with WordPress + WooCommerce that enables appointments and real‑time bookings.,Strong React frontend | WordPress + WooCommerce integration | Robust booking system with payment
https://qcso.org,Education,"WordPress, WooCommerce, jQuery","Authentication/Login, Newsletter","Quad City Symphony Orchestra - The QCSO, inspires, entertains, and engages the community through superb music, music education, and cultural leadership.",High,WordPress + WooCommerce,"lms, wordpress, learning management system, e-commerce, woocommerce",Education platform built with WordPress + WooCommerce that delivers a learning management platform.,WordPress + WooCommerce integration
https://www.foodchainid.com/,Education,"WordPress, WooCommerce, jQuery, Cloudflare","Authentication/Login, Search Functionality, Blog, Multilingual, Newsletter, Contact Form","The all in one solution for food contact, food safety, product certification, testing, regulatory compliance, risk assessment and more.",High,WordPress + WooCommerce,"lms, wordpress, learning management system, search functionality, multilingual, e-commerce, woocommerce",Education platform built with WordPress + WooCommerce that delivers a learning management platform.,WordPress + WooCommerce integration | Multilingual support for global audience
https://www.speechanddebate.org/,Education,"WordPress, WooCommerce, jQuery","Authentication/Login, Search Functionality, Newsletter","The National Speech & Debate Association connects, supports, and inspires a diverse community committed to empowering students through speech and debate.",High,WordPress + WooCommerce,"lms, wordpress, learning management system, search functionality, e-commerce, woocommerce",Education platform built with WordPress + WooCommerce that delivers a learning management platform.,WordPress + WooCommerce integration
https://lsiowa.org/,Education,"WordPress, WooCommerce, jQuery",Contact Form,Lutheran Services in Iowa (LSI) - Human Services Non-Profit,High,WordPress + WooCommerce,"lms, wordpress, learning management system, e-commerce, woocommerce",Education platform built with WordPress + WooCommerce that delivers a learning management platform.,WordPress + WooCommerce integration
https://fouroaks.org/,Education,"WordPress, WooCommerce, React, jQuery","Authentication/Login, Search Functionality, Newsletter, Contact Form","Four Oaks provides a wide variety of services to help over 27,000 children and families in Iowa per year be successful.",High,WordPress + WooCommerce,"spa, lms, react, wordpress, learning management system, search functionality, e-commerce, woocommerce",Education platform built with WordPress + WooCommerce that delivers a learning management platform.,Strong React frontend | WordPress + WooCommerce integration
https://unimovers.com/,Education,"WordPress, WooCommerce, jQuery","Booking System, Blog, Contact Form","UniMovers provides insured University and College Movers to help with your move! Move with us, after all, We Major in Moving!",High,WordPress + WooCommerce,"lms, booking system, wordpress, learning management system, appointment scheduling, e-commerce, woocommerce",Education platform built with WordPress + WooCommerce that enables appointments and real‑time bookings.,WordPress + WooCommerce integration | Robust booking system with payment
https://www.tl4j.com/,Education,"WordPress, WooCommerce, Vue.js, jQuery","Blog, Contact Form","Trial Lawyers for Justice is a national law firm dedicated to helping families and victims of brain injury, spinal cord injury, wrongful death, serious injury, crashes, medical malpractice.",High,WordPress + WooCommerce,"lms, wordpress, learning management system, e-commerce, woocommerce",Education platform built with WordPress + WooCommerce that delivers a learning management platform.,WordPress + WooCommerce integration
https://carnegiestout.org/,Education,"WordPress, WooCommerce, Bootstrap, jQuery","Authentication/Login, Search Functionality, Contact Form","The Carnegie-Stout Public Library has proudly served the Dubuque community since 1902. Visit today, and check out the possibilities!",High,WordPress + WooCommerce,"lms, wordpress, learning management system, search functionality, e-commerce, woocommerce",Education platform built with WordPress + WooCommerce that delivers a learning management platform.,WordPress + WooCommerce integration
https://qcso.org/,Education,"WordPress, WooCommerce, jQuery","Authentication/Login, Newsletter","Quad City Symphony Orchestra - The QCSO, inspires, entertains, and engages the community through superb music, music education, and cultural leadership.",High,WordPress + WooCommerce,"lms, wordpress, learning management system, e-commerce, woocommerce",Education platform built with WordPress + WooCommerce that delivers a learning management platform.,WordPress + WooCommerce integration
https://imsda.org/,Education,"WordPress, WooCommerce, Bootstrap, jQuery, Cloudflare","Authentication/Login, Search Functionality, Multilingual, Newsletter","As part of a worldwide movement with over 20 million members, we carry out the mission of the Seventh-day Adventist Church in Iowa and Missouri.",High,WordPress + WooCommerce,"lms, wordpress, learning management system, search functionality, multilingual, e-commerce, woocommerce",Education platform built with WordPress + WooCommerce that delivers a learning management platform.,WordPress + WooCommerce integration | Multilingual support for global audience
https://youssefhodaigui.com/,Education,"WordPress, WooCommerce, Tailwind CSS, jQuery","Search Functionality, Blog, Newsletter",Moroccan-American AI business strategist with 25+ years building and scaling online businesses. Founder of Mindflow Marketing & EarningPath. Helping professionals become AI-powered entrepreneurs through proven systems and real-world experience.,High,WordPress + WooCommerce,"lms, wordpress, learning management system, search functionality, e-commerce, woocommerce",Education platform built with WordPress + WooCommerce that delivers a learning management platform.,WordPress + WooCommerce integration
https://www.vlcelaw.com/,General Business,"WordPress, Wix, React, Bootstrap",Contact Form,"The Law Offices of Veronica Lopez-Calleja, PA in Miami delivers trusted family law legal guidance with personal attention tailored to every client’s unique needs. Veronica is a multi- award winning Miami divorce attorney with an incredible team with incredible person care for each and every one of the clients.",High,Mixed (WordPress + React),"spa, react",General Business platform built with Mixed (WordPress + React) that offers a professional web presence.,Strong React frontend
https://www.libertyhillep.com/,General Business,"WordPress, React, Tailwind CSS",Contact Form,"At Liberty Hill Equity Partners, we believe building a business is personal.",High,Mixed (WordPress + React),"spa, react",General Business platform built with Mixed (WordPress + React) that offers a professional web presence.,Strong React frontend
https://digital-authors.com/,General Business,"WordPress, jQuery",Authentication/Login,Get your book self-published internationally and reach a global audience! Your story. Your success. Your future.,High,Other,,General Business platform built with Other that offers a professional web presence.,
http://www.tamacountyiowa.org/,General Business,Cloudflare,Authentication/Login,DNS points to prohibited IP | www.tamacountyiowa.org | Cloudflare,High,Other,,General Business platform built with Other that offers a professional web presence.,
http://www.windmillparkjewelers.com/,General Business,Cloudflare,Authentication/Login,DNS points to prohibited IP | www.windmillparkjewelers.com | Cloudflare,High,Other,,General Business platform built with Other that offers a professional web presence.,
https://kayllaw.com/,General Business,jQuery,Contact Form,"Iowa trusted law firm working in Divorce, custody, criminal, mediation, and general law.",High,Other,,General Business platform built with Other that offers a professional web presence.,
https://www.humboldtcountynv.gov/518/Humboldt-County-Sheriffs-Office/,General Business,jQuery,"Authentication/Login, Search Functionality, Newsletter, Contact Form","The Humboldt County Sheriff’s Office is dedicated to the citizens living and visiting
Humboldt County by earning and maintaining their trust and confidence with professional law enforcement services. While carrying out daily duties and responsibilities, the Sheriff’s Office will ensure that the people’s constitutional rights are upheld.",High,Other,search functionality,General Business platform built with Other that offers a professional web presence.,
https://med-ease-frontend.vercel.app/,General Business,"React, Next.js",Contact Form,"Med'ease aide les patients et leurs proches à naviguer simplement dans le parcours de soins : informations centralisées, suivi en temps réel des rendez-vous, rappels personnalisés, et bien plus encore.",High,React / Next.js Custom,"spa, next.js, ssr, react",General Business platform built with React / Next.js Custom that offers a professional web presence.,Strong React frontend | SSR with Next.js for SEO
https://aifoundationsgroup.com/,General Business,React,Contact Form,"AI Foundations Group helps executives and boards build clarity, judgment, and trust around artificial intelligence through education, insight, and strategic understanding.",High,React / Next.js Custom,"spa, react",General Business platform built with React / Next.js Custom that offers a professional web presence.,Strong React frontend | SSR with Next.js for SEO
https://www.pg77id.com/,General Business,"React, Cloudflare",Authentication/Login,"PG77 adalah pilihan utama bagi pecinta game slot pg soft di Indonesia. Menawarkan berbagai permainan slot populer seperti Mahjong Ways 1 & 2, Wild Bandito, Wild West Gold dan link apk anti blokir.",High,React / Next.js Custom,"spa, react",General Business platform built with React / Next.js Custom that offers a professional web presence.,Strong React frontend | SSR with Next.js for SEO
https://www.afternic.com/forsale/goldmarketmedia.com?traffic_id=GoDaddy_DLS&traffic_type=TDFS&utm_campaign=TDFS_GoDaddy_DLS&utm_medium=sn_affiliate_click&utm_source=TDFS,General Business,"React, Next.js, Vue.js, Bootstrap",Contact Form,goldmarketmedia.com is for sale on Afternic. Get a price in less than 24 hours from our domain experts.,High,React / Next.js Custom,"spa, next.js, ssr, react",General Business platform built with React / Next.js Custom that offers a professional web presence.,Strong React frontend | SSR with Next.js for SEO
https://2pifi.com/,General Business,"WordPress, WooCommerce, jQuery",Contact Form,"Enterprise-Grade Starlink, LEO and Fixed Wireless Deployment, Installation, and Support - 2pifi",High,WordPress + WooCommerce,"woocommerce, e-commerce, wordpress",General Business platform built with WordPress + WooCommerce that offers a professional web presence.,WordPress + WooCommerce integration
https://vibrationsdj.com/,General Business,"WordPress, WooCommerce, Bootstrap, jQuery","Authentication/Login, Contact Form",We deliver unforgettable experiences for weddings and corporate celebrations. Book today.,High,WordPress + WooCommerce,"woocommerce, e-commerce, wordpress",General Business platform built with WordPress + WooCommerce that offers a professional web presence.,WordPress + WooCommerce integration
https://midwestprofessionalstaffing.com/,General Business,"WordPress, WooCommerce, Vue.js, jQuery","Search Functionality, Contact Form",Midwest Professional Staffing | Connecting talented candidates with outstanding companies….,High,WordPress + WooCommerce,"search functionality, woocommerce, e-commerce, wordpress",General Business platform built with WordPress + WooCommerce that offers a professional web presence.,WordPress + WooCommerce integration
https://corviahealthcare.com/,Healthcare,"WordPress, React, jQuery","Authentication/Login, Booking System, Newsletter, Contact Form","Corvia Healthcare offers medically supervised cardiac rehab, combining therapy and exercise to improve heart health, recovery, and long-term wellness.",High,Mixed (WordPress + React),"spa, booking system, appointment scheduling, react",Healthcare platform built with Mixed (WordPress + React) that enables appointments and real‑time bookings.,Strong React frontend | Robust booking system with payment
https://faviolathompsonesthetic.com/,Healthcare,"WordPress, React, jQuery","Booking System, Contact Form","Faviola Thompson ESTHETIC – ESTHETIC – Where Beauty Meets Elegance, Naturally",High,Mixed (WordPress + React),"spa, booking system, appointment scheduling, react",Healthcare platform built with Mixed (WordPress + React) that enables appointments and real‑time bookings.,Strong React frontend | Robust booking system with payment
https://hospiceofthemidwest.com/,Healthcare,"WordPress, React, jQuery","Search Functionality, Blog, Newsletter, Contact Form","Hospice care is an affirmation of life that focuses on comfort, pain-free care when a loved one is faced with a terminal illness.",High,Mixed (WordPress + React),"spa, search functionality, react",Healthcare platform built with Mixed (WordPress + React) that offers a professional web presence.,Strong React frontend
https://loras.edu/,Healthcare,"WordPress, React, Bootstrap, jQuery","Search Functionality, Newsletter","Loras, a Catholic liberal arts college in Iowa, has a community of active learners, reflective thinkers, ethical decision-makers, and responsible contributors.",High,Mixed (WordPress + React),"spa, search functionality, react",Healthcare platform built with Mixed (WordPress + React) that offers a professional web presence.,Strong React frontend
https://relion-ins.com/,Healthcare,"WordPress, React, jQuery","Authentication/Login, Search Functionality, Blog, Contact Form","Relion Insurance Solutions offers personal, business, benefits, and loss control insurance to meet the needs of clients in Iowa and beyond.",High,Mixed (WordPress + React),"spa, search functionality, react",Healthcare platform built with Mixed (WordPress + React) that offers a professional web presence.,Strong React frontend
https://www.cathchar.com/,Healthcare,"WordPress, Wix, React, Bootstrap","Newsletter, Contact Form","Catholic Charities is here to welcome you and work hard, through therapy and community service, so you receive the most effective care available. You can live a happier, healthier life!",High,Mixed (WordPress + React),"spa, react",Healthcare platform built with Mixed (WordPress + React) that offers a professional web presence.,Strong React frontend
https://americaneyecare.com/,Healthcare,"WordPress, React, jQuery","Booking System, Blog, Contact Form",American EyeCare is your local Optometrist in Keokuk serving all of your needs. Call us today at 319-524-2020 for an appointment.,High,Mixed (WordPress + React),"spa, booking system, appointment scheduling, react",Healthcare platform built with Mixed (WordPress + React) that enables appointments and real‑time bookings.,Strong React frontend | Robust booking system with payment
https://www.familyhealthcarecenter.com/,Healthcare,"WordPress, Bootstrap, jQuery","Authentication/Login, Booking System","Family Health Care Center provides the highest quality care to patients of all ages. In-office lab, radiology, and more make visits easy and convenient.",High,Other,"booking system, appointment scheduling",Healthcare platform built with Other that enables appointments and real‑time bookings.,Robust booking system with payment
https://midlandscare.co.uk/,Healthcare,"WordPress, Bootstrap, jQuery","Search Functionality, Blog, Multilingual, Contact Form",Find the best elderly care home near you in Leicester. We offer residential care homes for old people with personalised services in Leicestershire & Blaby.,High,Other,"multilingual, search functionality",Healthcare platform built with Other that offers a professional web presence.,Multilingual support for global audience
https://www.aureuscleaning.com/,Healthcare,Squarespace,Contact Form,"Aureus Cleaning offers professional commercial cleaning services, including office, rental, and specialty cleaning. Trust our expert team for a spotless, healthy workspace.",High,Other,,Healthcare platform built with Other that offers a professional web presence.,
https://www.uclahealth.org/,Healthcare,"Bootstrap, jQuery","Search Functionality, Booking System, Multilingual, Newsletter, Contact Form","Ranked as one of America's top hospitals, UCLA Health provides the best care at its 5 hospitals and more than 290 locations throughout Southern California.",High,Other,"search functionality, multilingual, booking system, appointment scheduling",Healthcare platform built with Other that enables appointments and real‑time bookings.,Robust booking system with payment | Multilingual support for global audience
https://sib-wellness.com/,Healthcare,"WordPress, jQuery","Booking System, Contact Form","SIB Wellness Center offers holistic wellness solutions designed to improve your health, balance your lifestyle, and support your overall wellbeing through personalized care and guidance.",High,Other,"booking system, appointment scheduling",Healthcare platform built with Other that enables appointments and real‑time bookings.,Robust booking system with payment
https://limegreen-baboon-476420.hostingersite.com/,Healthcare,"WordPress, jQuery",Booking System,"FREEDOM+ – PFM PFD Incontinence, Pelvic Floor Muscle",High,Other,"booking system, appointment scheduling",Healthcare platform built with Other that enables appointments and real‑time bookings.,Robust booking system with payment
https://www.apexoralsurgery.org/,Healthcare,"WordPress, jQuery, Cloudflare","Booking System, Blog, Newsletter, Contact Form","Apex Oral Surgery in Tallahassee, FL provides quality oral surgery, dental implants, wisdom tooth removal, bone grafting, and full arch restoration. Book now!",High,Other,"booking system, appointment scheduling",Healthcare platform built with Other that enables appointments and real‑time bookings.,Robust booking system with payment
https://katieaustin.tv/,Healthcare,"jQuery, Cloudflare",Authentication/Login,"Realistic, minimal equipment workouts and simple recipes for your everyday lifestyle.",High,Other,,Healthcare platform built with Other that offers a professional web presence.,
