# Summary: total rows=1846, high‑quality=1112, most common stacks=Other (743); Shopify Advanced (412); WordPress + WooCommerce (397), best SaaS=https://script.tonatheme.com/tonaptc/demo/, best Booking=https://iowaschoolforthedeaf.org/, best E‑commerce=https://martfury.botble.com/
Website URL,Category,Used Stack,Website Features,Brief Description,Quality,Main Technology,Keywords,Use_Case,Strengths
https://www.loungelizard.com/,Agency,"WordPress, Vue.js, jQuery, Laravel","Search Functionality, Blog, Multilingual, Newsletter","Top-rated web design company, Lounge Lizard Worldwide, drives results & ROI since 1998. Request a website design proposal today!",High,Laravel / Custom PHP,"laravel, multilingual, search functionality, php",Agency platform built with Laravel / Custom PHP that offers a professional web presence.,Laravel backend with custom APIs | Multilingual support for global audience
https://www.octaveagency.com/,Agency,"WordPress, React, jQuery","Authentication/Login, Search Functionality, Blog, Multilingual, Contact Form","As a web design agency, Octave strategically plan, design, develop, and provide ongoing support for high-performing websites.",High,Mixed (WordPress + React),"spa, multilingual, search functionality, react",Agency platform built with Mixed (WordPress + React) that offers a professional web presence.,Strong React frontend | Multilingual support for global audience
https://www.paarlance.com/,Agency,"WordPress, Wix, React, Bootstrap",Blog,"Experienced copywriter for hire Ruth Paarmann of Paarlance Creative Writing crafts website copy, marketing materials, scripts, bios and articles for agencies, entrepreneurs and organizations across the U.S. For memorable, compelling copywriting services, contact Paarlance Creative Writing.",High,Mixed (WordPress + React),"spa, react",Agency platform built with Mixed (WordPress + React) that offers a professional web presence.,Strong React frontend
https://wearesculpt.com/,Agency,"WordPress, React, jQuery","Search Functionality, Blog","We are Sculpt, a social media marketing agency with Hustle & Heart. We help your brand build audiences that care, share, and convert. What's your story?",High,Mixed (WordPress + React),"spa, search functionality, react",Agency platform built with Mixed (WordPress + React) that offers a professional web presence.,Strong React frontend
https://iowaschoolforthedeaf.org/,Agency,"WordPress, React, jQuery, Cloudflare","Authentication/Login, Booking System, Blog, Multilingual, Newsletter, Contact Form","At Iowa School for the Deaf, children thrive through communication, opportunity, independence and a sense of belonging for academic and social success.",High,Mixed (WordPress + React),"spa, booking system, react, multilingual, appointment scheduling",Agency platform built with Mixed (WordPress + React) that enables appointments and real‑time bookings.,Strong React frontend | Robust booking system with payment | Multilingual support for global audience
https://upqode.com/,Agency,"WordPress, Squarespace, jQuery, Cloudflare","Blog, Contact Form","Award-Winning Web Design & Website Development Company. Full-stack Web Agency With Highly Experienced WordPress Developers, Coders, SEO experts & Designers.",High,Other,,Agency platform built with Other that offers a professional web presence.,
https://www.moburst.com/,Agency,"WordPress, jQuery, Cloudflare","Search Functionality, Booking System, Blog, Newsletter","Our marketing agency helps companies grow by making them category leaders. Our services include mobile marketing, web & app awareness, media buying, and more.",High,Other,"search functionality, booking system, appointment scheduling",Agency platform built with Other that enables appointments and real‑time bookings.,Robust booking system with payment
https://www.siegelgale.com/,Agency,"WordPress, jQuery",Search Functionality,"Siegel+Gale is a global branding agency headquartered in New York. Our expertise spans brand development, brand strategy, design, and customer experience.",High,Other,search functionality,Agency platform built with Other that offers a professional web presence.,
https://www.10degrees.uk/,Agency,"WordPress, Cloudflare","Authentication/Login, Search Functionality, Booking System","Long-term WordPress stewardship and bespoke systems for higher education. We help academic teams run accessible, governable platforms that last.",High,Other,"search functionality, booking system, appointment scheduling",Agency platform built with Other that enables appointments and real‑time bookings.,Robust booking system with payment
https://ghostwhite-rabbit-242489.hostingersite.com/,Agency,"WordPress, jQuery",Contact Form,FozMov – Filming Comedians and Musicians – Boston – NY,High,Other,,Agency platform built with Other that offers a professional web presence.,
https://www.beaconmm.com/,Agency,"WordPress, jQuery","Search Functionality, Blog, Contact Form",Get digital marketing designed to grow and scale your mental or behavioral health business. Reach out to book a discovery call today!,High,Other,search functionality,Agency platform built with Other that offers a professional web presence.,
https://www.elleandcompanydesign.com/,Agency,"Squarespace, Bootstrap","Blog, Newsletter",Elle & Company helps businesses create a stunning first impression online.,High,Other,,Agency platform built with Other that offers a professional web presence.,
https://www.campbellinsure.com/,Agency,"WordPress, Vue.js, jQuery",Blog,"Home Insurance, Auto Insurance, Farm Insurance, and Business Insurance. Insurance in Council Bluffs, IA, Omaha, NE, Bellevue, NE, Papillion, NE, and Treynor, IA, including Motorcycle, Contractors, and Car Insurance.",High,Other,,Agency platform built with Other that offers a professional web presence.,
https://www.515productions.com/,Agency,"WordPress, Bootstrap, jQuery",Blog,Create powerful connections with your audience through the power of cinematic storytelling.,High,Other,,Agency platform built with Other that offers a professional web presence.,
https://discoverimpact.com,Agency,"WordPress, Bootstrap, jQuery","Search Functionality, Blog, Contact Form",This Domain Is For Sale - Buy This Premium Domain Name,High,Other,search functionality,Agency platform built with Other that offers a professional web presence.,
https://www.ccsames.org/,Agency,Squarespace,"Authentication/Login, Newsletter, Contact Form","Creative Counseling Services offers a unique, nonprofit mental health program called ""Gap to Growth,"" where master's level interns provide free counseling services. We eliminate financial barriers and wait lists, ensuring accessible mental health support. Your donations help us continue this valuable program.",High,Other,,Agency platform built with Other that offers a professional web presence.,
https://discoverimpact.com,Agency,"WordPress, Bootstrap, jQuery","Search Functionality, Blog, Contact Form",This Domain Is For Sale - Buy This Premium Domain Name,High,Other,search functionality,Agency platform built with Other that offers a professional web presence.,
http://www.zlrignition.com/,Agency,"WordPress, Bootstrap, jQuery",Search Functionality,"We’re a full-service branding and marketing agency known for smart strategy, sharp insights and standout creative. Ready to spark change? Let’s talk.",High,Other,search functionality,Agency platform built with Other that offers a professional web presence.,
https://fuelbranding.com/,Agency,"WordPress, jQuery","Blog, Contact Form",FUEL is a design firm specializing in brand development. We leverage the power of design to give companies and organizations in the Midwest a competitive advantage.,High,Other,,Agency platform built with Other that offers a professional web presence.,
https://www.whitingcsd.org/,Agency,"Squarespace, Bootstrap","Authentication/Login, Search Functionality, Contact Form","Homepage for the Whiting Warriors! A place for students, staff, parents and the public to view information about Whiting Community School.",High,Other,search functionality,Agency platform built with Other that offers a professional web presence.,
https://iowatrenchless.com/,Agency,"WordPress, jQuery","Newsletter, Contact Form","Iowa Trenchless provides expert boring, tunneling, and underground construction services across Iowa with safe, efficient, low-impact solutions.",High,Other,,Agency platform built with Other that offers a professional web presence.,
https://thelegalhill.com/,Agency,"WordPress, jQuery, Cloudflare","Blog, Contact Form","The Legal Hill, PLLC provides compassionate family law services in Spokane, WA, including divorce, custody, mediation, and guardianships.",High,Other,,Agency platform built with Other that offers a professional web presence.,
https://www.thepalmergroup.com/,Agency,jQuery,"Search Functionality, Blog, Contact Form",Palmer Group is an employment agency that has been connecting employers and job seekers since 1998.,High,Other,search functionality,Agency platform built with Other that offers a professional web presence.,
https://www.graceland.edu/,Agency,"WordPress, jQuery","Authentication/Login, Search Functionality, Booking System, Blog","With over 35 areas of study, you'll be sure to find a direction that’s right for your future in one of our in-person or online programs.",High,Other,"search functionality, booking system, appointment scheduling",Agency platform built with Other that enables appointments and real‑time bookings.,Robust booking system with payment
https://corridorbusiness.com/,Agency,"WordPress, jQuery, Cloudflare","Authentication/Login, Search Functionality, Newsletter","Critical business news, thoughtful analysis and valuable strategic insights for business leaders in the growing Iowa City and Cedar Rapids Corridor.",High,Other,search functionality,Agency platform built with Other that offers a professional web presence.,
https://www.strategicamerica.com/,Agency,"WordPress, jQuery",Search Functionality,"Strategic America is an independent, full-service marketing and advertising agency dedicated to putting brands on the path to success. See how!",High,Other,search functionality,Agency platform built with Other that offers a professional web presence.,
https://itsahappymedium.com/,Agency,"WordPress, jQuery, Cloudflare","Blog, Newsletter, Contact Form","Happy Medium is a full-service digital creative agency in Des Moines, IA. We transform businesses through media strategy, digital development, and more!",High,Other,,Agency platform built with Other that offers a professional web presence.,
https://www.stamats.com/,Agency,"WordPress, jQuery, Cloudflare","Search Functionality, Newsletter, Contact Form",Stamats is more than a professional services provider—we're an indispensable extension of your marketing team.,High,Other,search functionality,Agency platform built with Other that offers a professional web presence.,
https://www.metro-studios.com/,Agency,"WordPress, jQuery","Authentication/Login, Search Functionality, Blog, Multilingual, Contact Form","We're a team of digital marketers, web developers, & creatives making custom strategies that drive qualified traffic & leads to your website.",High,Other,"multilingual, search functionality",Agency platform built with Other that offers a professional web presence.,Multilingual support for global audience
https://www.lessingflynn.com/,Agency,"WordPress, Vue.js, jQuery","Search Functionality, Blog, Newsletter, Contact Form","Ready for fearless, results-driven marketing? Lessing-Flynn is a leading marketing agency — delivering creative, strategic solutions that drive success since 1907.",High,Other,search functionality,Agency platform built with Other that offers a professional web presence.,
https://www.strategicelements.com/,Agency,"WordPress, jQuery","Blog, Contact Form","Strategic Elements, a trusted full-service public affairs, communications, and marketing firm based in Iowa and serving clients nationwide",High,Other,,Agency platform built with Other that offers a professional web presence.,
https://www.mindfirecomm.com/,Agency,"WordPress, jQuery","Search Functionality, Blog, Newsletter","MindFire is a full-service marketing firm based in Le Claire, IA, that leads with research & strategy to deliver unmatched creative & ROI for clients big & small.",High,Other,search functionality,Agency platform built with Other that offers a professional web presence.,
https://www.profol.de/,Agency,"WordPress, jQuery","Search Functionality, Multilingual","Wir produzieren Cast Polypropylen Folien und Leichtbau Composites (Organo Sheet, UD-Tape, Sandwichplatten) für verschiedene Märkte.",High,Other,"multilingual, search functionality",Agency platform built with Other that offers a professional web presence.,Multilingual support for global audience
https://www.flyinghippo.com/,Agency,"WordPress, Vue.js, jQuery","Search Functionality, Blog","A unique breed of branding experts and digital nerds, our HubSpot-certified mammals are ready for your branding needs.",High,Other,search functionality,Agency platform built with Other that offers a professional web presence.,
https://www.chatterkick.com/,Agency,Squarespace,"Blog, Newsletter, Contact Form","Discover expert social media strategies, website development, and consulting to scale your brand efficiently. Results-driven solutions for complex brand structures.",High,Other,,Agency platform built with Other that offers a professional web presence.,
http://www.zlrignition.com/,Agency,"WordPress, Bootstrap, jQuery",Search Functionality,"We’re a full-service branding and marketing agency known for smart strategy, sharp insights and standout creative. Ready to spark change? Let’s talk.",High,Other,search functionality,Agency platform built with Other that offers a professional web presence.,
https://rightideacreative.com/,Agency,"WordPress, jQuery","Search Functionality, Contact Form","We’ve got the right ideas for your marketing campaign. Learn how we help your business meet your sales, advertising, and marketing objectives.",High,Other,search functionality,Agency platform built with Other that offers a professional web presence.,
https://thinkdenovo.com/,Agency,"WordPress, jQuery","Search Functionality, Blog, Newsletter","When you work with de Novo you're not just hiring a marketing agency—you’re expanding your team. Find refreshingly meaningful work, relationships & results inside.",High,Other,search functionality,Agency platform built with Other that offers a professional web presence.,
https://www.centralriversaea.org/,Agency,"WordPress, jQuery","Search Functionality, Booking System, Contact Form","Central Rivers AEA partners with educators, families, and communities to improve student learning. We offer resources and support in areas like instructional materials, curriculum, technology, special education, professional learning, and more.",High,Other,"search functionality, booking system, appointment scheduling",Agency platform built with Other that enables appointments and real‑time bookings.,Robust booking system with payment
https://bchlife.com/,Agency,"WordPress, jQuery","Authentication/Login, Multilingual, Contact Form",Our expertise in life insurance and commitment to being a dependable and transparent partner will help you serve more clients and achieve success.,High,Other,multilingual,Agency platform built with Other that offers a professional web presence.,Multilingual support for global audience
https://www.simonsonassoc.com/,Agency,WordPress,"Search Functionality, Contact Form","Located in Des Moines, Iowa, Simonson & Associates Architects are experts in residential, multi-family and senior living planning and building.",High,Other,search functionality,Agency platform built with Other that offers a professional web presence.,
https://www.kupkateam.com:443/,Agency,"WordPress, jQuery","Authentication/Login, Booking System, Contact Form","Ames, IA Refinance & Mortgage EXPERTS! The most experienced & ethical Ames Mortgage Brokers offering you the best service and fees, with low Ames mortgage rates for all your Ames home loan & refinance needs! Guild Mortgage - Home",High,Other,"booking system, appointment scheduling",Agency platform built with Other that enables appointments and real‑time bookings.,Robust booking system with payment
https://gosling.cpa/,Agency,"WordPress, Bootstrap, jQuery",Contact Form,"Gosling and Company CPA - Accounting Services in Manchester, Iowa",High,Other,,Agency platform built with Other that offers a professional web presence.,
https://www.stcroixhospice.com/,Agency,"WordPress, jQuery","Search Functionality, Contact Form","St. Croix Hospice local caregivers are available 24/7, providing quality, expert hospice care. Learn about hospice care services and locations here.",High,Other,search functionality,Agency platform built with Other that offers a professional web presence.,
https://integritycommunications.com/,Agency,"Bootstrap, jQuery","Search Functionality, Multilingual, Contact Form",We're a professional development firm based near the Des Moines metro. Let’s work together to create professional growth opportunities for your employees.,High,Other,"multilingual, search functionality",Agency platform built with Other that offers a professional web presence.,Multilingual support for global audience
https://www.electricalconceptscr.com/,Agency,"WordPress, jQuery, Cloudflare",Contact Form,"From residential to commercial services, the professionals at Electrical Concepts have been your partners in electrical solutions since 2002.",High,Other,,Agency platform built with Other that offers a professional web presence.,
https://sigmawraps.com/,Agency,"WordPress, jQuery","Blog, Contact Form",Stand out with eye-catching vehicle wraps advertising in Texas. SigmaGrafix is the leader in Texas for high-quality auto wraps.,High,Other,,Agency platform built with Other that offers a professional web presence.,
https://rxscam.vercel.app/,Agency,"React, Next.js","Authentication/Login, Search Functionality, Payment Integration, Multilingual",The most advanced AI Powered asset protection on the planet,High,React / Next.js Custom,"spa, react, search functionality, multilingual, ssr, next.js",Agency platform built with React / Next.js Custom that offers a professional web presence.,Strong React frontend | SSR with Next.js for SEO | Multilingual support for global audience
https://pensdio-git-main-mdemong87-gmailcom.vercel.app/,Agency,"React, Next.js","Booking System, Blog, Multilingual, Newsletter, Contact Form","Make Brands That Are Human-Centered And Compelling. Join our vibrant global digital consultancy. Discover cutting-edge solutions and tap into unparalleled expertise for success in the dynamic and ever-evolving digital landscape. Let's collaborate for excellence and growth in your digital endeavor.digital branding agency ,creative graphic design service,motion graphics company ,UX/UI product design, web development agency, social media advertising solutions, copywriting services, branding design, graphic design firm,user experience design.affordable branding design for USA businesses,explainer video production for UAE companies ,custom website design for Canadian startup,e-commerce website development for UK businesses,social media advertising for German companies in English,logo design for international startups,content writing services for international websites,best digital marketing agencies for international businesses,hire a branding agency for international expansion,create an animated explainer video for a global audience,design a high-converting website for international markets,increase website traffic internationally with SEO,manage social media accounts for international businesses in multiple languages,write website content that ranks globally,create Google Ads campaigns targeting international audiences,affordable digital marketing solutions for international businesses,design a logo for a global brand,the best copywriter for international website content",High,React / Next.js Custom,"spa, booking system, react, multilingual, ssr, appointment scheduling, next.js",Agency platform built with React / Next.js Custom that enables appointments and real‑time bookings.,Strong React frontend | SSR with Next.js for SEO | Robust booking system with payment
https://digiflow-next.vercel.app/,Agency,"Webflow, React, Next.js","Blog, Newsletter, Contact Form","Digiflow is a professionally designed Figma template tailored for Digital Agency websites! Whether you’re building a site for any business related to agency, business, digital agency, and portfolio website, Pixelo provides modern, clean, and fully customizable templates to help you create an impactful online presence. Its user-friendly design ensures an effortless and smooth design process for developers and designers alike.",High,React / Next.js Custom,"spa, next.js, ssr, react",Agency platform built with React / Next.js Custom that offers a professional web presence.,Strong React frontend | SSR with Next.js for SEO
https://www.theadigroup.net/,Agency,"Wix, React, Bootstrap","Newsletter, Contact Form","ADi Group has 75 years of experience providing custom marketing solutions to clients of all industries. ADi Group is your one place to call for logoed apparel and caps, promotional products, and print services in Urbandale, Iowa.",High,React / Next.js Custom,"spa, react",Agency platform built with React / Next.js Custom that offers a professional web presence.,Strong React frontend | SSR with Next.js for SEO
https://www.intelligentics.com/,Agency,"Webflow, jQuery","Search Functionality, Contact Form",Boost your business with Intelligentics' customer research & insights. Discover data-driven strategies to enhance customer satisfaction & growth today.,High,Webflow,search functionality,Agency platform built with Webflow that offers a professional web presence.,
https://www.truenorthcompanies.com/,Agency,"Webflow, jQuery, Cloudflare","Authentication/Login, Blog, Newsletter, Contact Form","Discover insurance, risk, and financial solutions tailored to businesses, individuals and families nationwide. Find your TrueNorth today.",High,Webflow,,Agency platform built with Webflow that offers a professional web presence.,
https://www.editcrew.com/,Agency,"Webflow, Vue.js, jQuery","Authentication/Login, Shopping Cart, Blog","Hire talented team of professional video editors, producers, and a project manager. 1-2 business day turnarounds with minimal work from you.",High,Webflow,"payment integration, shopping cart",Agency platform built with Webflow that provides an online store with payment integration.,Full shopping cart and checkout flow
https://directiveconsulting.com/,Agency,"WordPress, WooCommerce, jQuery, Cloudflare","Authentication/Login, Search Functionality, Blog, Newsletter, Contact Form","Directive elevates B2B marketers from MQLs to qualified pipeline with Customer Generation methodology. 420+ brands served, $1B+ revenue.",High,WordPress + WooCommerce,"search functionality, woocommerce, e-commerce, wordpress",Agency platform built with WordPress + WooCommerce that offers a professional web presence.,WordPress + WooCommerce integration
https://www.clickintelligence.co.uk/,Agency,"WordPress, WooCommerce, jQuery, Cloudflare","Authentication/Login, Search Functionality, Blog, Contact Form","Award Winning Search Marketing Agency Offering SEO, AI search Optimisation, Link Building, Ai SEO, Content, PPC and Paid Social Based In London & Cheltenham.",High,WordPress + WooCommerce,"search functionality, woocommerce, e-commerce, wordpress",Agency platform built with WordPress + WooCommerce that offers a professional web presence.,WordPress + WooCommerce integration
https://www.cookwithmanali.com/,Agency,"WordPress, WooCommerce, React, jQuery, Cloudflare","Search Functionality, Newsletter","Popular Indian recipes with step-by-step cooking instructions from cookbook author Manali Singh. The Cook with Manali recipe catalogue includes 1000+ authentic, approachable Indian vegetarian dishes.",High,WordPress + WooCommerce,"spa, react, wordpress, search functionality, e-commerce, woocommerce",Agency platform built with WordPress + WooCommerce that offers a professional web presence.,Strong React frontend | WordPress + WooCommerce integration
https://bellyagency.co.uk/,Agency,"WordPress, WooCommerce, React, jQuery","Blog, Newsletter","Bold branding, tasty content, smart SEO & paid ads to help food and beverage brands grow, stand out, and satisfy their audience. Let’s cook now!",High,WordPress + WooCommerce,"spa, react, wordpress, e-commerce, woocommerce",Agency platform built with WordPress + WooCommerce that offers a professional web presence.,Strong React frontend | WordPress + WooCommerce integration
https://www.deanandwaters.com/,Agency,"WordPress, WooCommerce, jQuery",Contact Form,"Dean & Waters Superyacht Management UK puts you first. Explore our bespoke services for owners, captains, and crew, backed by our outstanding industry reputation.",High,WordPress + WooCommerce,"woocommerce, e-commerce, wordpress",Agency platform built with WordPress + WooCommerce that offers a professional web presence.,WordPress + WooCommerce integration
https://bemytech.com/,Agency,"WordPress, WooCommerce, React, jQuery","Authentication/Login, Blog, Contact Form","Be My Tech builds high-converting websites, branding & automation systems that generate leads for US businesses. Book a free call today.",High,WordPress + WooCommerce,"spa, react, wordpress, e-commerce, woocommerce",Agency platform built with WordPress + WooCommerce that offers a professional web presence.,Strong React frontend | WordPress + WooCommerce integration
